{
  "schema_version": "lp.cli.report@0.1.0",
  "command": "app list",
  "ok": true,
  "exit_code": 0,
  "diagnostics": [],
  "meta": {
    "tool": "x07lp",
    "version": "__ANY__",
    "run_id": "__ANY__"
  },
  "result": {
    "schema_version": "lp.app.list.result@0.1.0",
    "view": "list",
    "index": {
      "used": true,
      "rebuilt": "__ANY__",
      "db_path": "__ANY__"
    },
    "generated_unix_ms": "__ANY__",
    "items": [
      {
        "app_id": "app_min",
        "environment": "staging",
        "latest_deployment_id": "__ANY__",
        "deployment_status": "__ANY__",
        "outcome": "__ANY__",
        "public_listener": "__ANY__",
        "current_weight_pct": "__ANY__",
        "incident_count_total": "__ANY__",
        "incident_count_open": "__ANY__",
        "latest_incident_id": "__ANY__",
        "latest_decision_id": "__ANY__",
        "kill_state": "__ANY__",
        "updated_unix_ms": "__ANY__"
      }
    ]
  }
}
