{
  "schema_version": "lp.cli.report@0.1.0",
  "command": "deploy query",
  "ok": true,
  "exit_code": 0,
  "diagnostics": [],
  "meta": {
    "tool": "x07lp",
    "version": "__ANY__",
    "run_id": "__ANY__"
  },
  "result": {
    "schema_version": "lp.deploy.query.result@0.1.0",
    "view": "artifacts",
    "deployment_id": "__ANY__",
    "run_id": "__ANY__",
    "target": {
      "app_id": "app_min",
      "environment": "staging"
    },
    "resolution": {
      "by": "deployment_id",
      "requested_deployment_id": "__ANY__"
    },
    "index": {
      "used": true,
      "rebuilt": "__ANY__",
      "db_path": "__ANY__"
    },
    "artifacts": [
      {
        "role": "decision_record",
        "ord": 0,
        "kind": "lp.decision.record@0.1.0",
        "digest": {
          "sha256": "__ANY__",
          "bytes_len": "__ANY__"
        },
        "media_type": "application/json",
        "logical_name": "decision.record",
        "store_uri": "__ANY__"
      },
      {
        "role": "deploy_execution",
        "ord": 0,
        "kind": "lp.deploy.execution@0.1.0",
        "digest": {
          "sha256": "__ANY__",
          "bytes_len": "__ANY__"
        },
        "media_type": "application/json",
        "logical_name": "deploy.execution",
        "store_uri": "__ANY__"
      },
      {
        "role": "deploy_plan",
        "ord": 0,
        "kind": "x07.deploy.plan@0.2.0",
        "digest": {
          "sha256": "__ANY__",
          "bytes_len": "__ANY__"
        },
        "media_type": "application/json",
        "logical_name": "deploy.plan",
        "store_uri": "__ANY__"
      },
      {
        "role": "metrics_snapshot",
        "ord": 0,
        "kind": "x07.metrics.snapshot@0.1.0",
        "digest": {
          "sha256": "__ANY__",
          "bytes_len": "__ANY__"
        },
        "media_type": "application/json",
        "logical_name": "analysis.1.json",
        "store_uri": "__ANY__"
      },
      {
        "role": "slo_eval_report",
        "ord": 0,
        "kind": "__ANY__",
        "digest": {
          "sha256": "__ANY__",
          "bytes_len": "__ANY__"
        },
        "media_type": "__ANY__",
        "logical_name": "__ANY__",
        "store_uri": "__ANY__"
      }
    ]
  }
}
