{
  "schema_version": "lp.cli.report@0.1.0",
  "command": "incident capture",
  "ok": true,
  "exit_code": 0,
  "diagnostics": [],
  "meta": {
    "tool": "x07lp",
    "version": "__ANY__",
    "run_id": "__ANY__"
  },
  "result": {
    "schema_version": "lp.incident.query.result@0.1.0",
    "view": "full",
    "resolution": {
      "by": "incident_id",
      "requested_incident_id": "__ANY__"
    },
    "index": {
      "used": true,
      "rebuilt": "__ANY__",
      "db_path": "__ANY__"
    },
    "incident_id": "__ANY__",
    "classification": "http_5xx",
    "source": "router",
    "incident_status": "open",
    "target": {
      "app_id": "app_min",
      "environment": "staging"
    },
    "deployment_id": "__ANY__",
    "run_id": "__ANY__",
    "captured_unix_ms": "__ANY__",
    "request_id": "__ANY__",
    "trace_id": "__ANY__",
    "status_code": 500,
    "decision_id": "__ANY__",
    "regression_status": "not_requested",
    "regression_id": null,
    "signature_status": "__ANY__",
    "bundle": {
      "kind": "lp.incident.bundle@0.1.0",
      "digest": {
        "sha256": "__ANY__",
        "bytes_len": "__ANY__"
      },
      "store_uri": "__ANY__"
    },
    "meta": {
      "schema_version": "lp.incident.bundle.meta.local@0.1.0",
      "classification": "http_5xx",
      "source": "router",
      "incident_status": "open",
      "target": {
        "app_id": "app_min",
        "environment": "staging"
      },
      "deployment_id": "__ANY__",
      "run_id": "__ANY__",
      "captured_unix_ms": "__ANY__"
    }
  }
}
