{
  "schema_version": "lp.cli.report@0.1.0",
  "command": "deploy query",
  "ok": true,
  "exit_code": 0,
  "diagnostics": [],
  "meta": {
    "tool": "x07lp",
    "version": "__ANY__",
    "run_id": "__ANY__"
  },
  "result": {
    "schema_version": "lp.deploy.query.result@0.1.0",
    "view": "summary",
    "deployment_id": "__ANY__",
    "run_id": "__ANY__",
    "target": {
      "app_id": "app_min",
      "environment": "staging"
    },
    "resolution": {
      "by": "deployment_id",
      "requested_deployment_id": "__ANY__"
    },
    "index": {
      "used": true,
      "rebuilt": "__ANY__",
      "db_path": "__ANY__"
    },
    "status": "completed",
    "outcome": "promoted",
    "created_unix_ms": "__ANY__",
    "updated_unix_ms": "__ANY__",
    "current_weight_pct": 100,
    "public_listener": "__ANY__",
    "latest_decision_id": "__ANY__",
    "plan_digest": {
      "sha256": "__ANY__",
      "bytes_len": "__ANY__"
    },
    "stable_revision": {
      "sha256": "__ANY__",
      "bytes_len": "__ANY__"
    },
    "candidate_revision": {
      "sha256": "__ANY__",
      "bytes_len": "__ANY__"
    }
  }
}
