{
  "schema_version": "lp.cli.report@0.1.0",
  "command": "incident list",
  "ok": true,
  "exit_code": 0,
  "diagnostics": [],
  "meta": {
    "tool": "x07lp",
    "version": "__ANY__",
    "run_id": "__ANY__"
  },
  "result": {
    "schema_version": "lp.incident.query.result@0.2.0",
    "view": "list",
    "resolution": {
      "by": "target",
      "requested_target": {
        "app_id": "app_min",
        "environment": "staging"
      }
    },
    "index": {
      "used": true,
      "rebuilt": "__ANY__",
      "db_path": "__ANY__"
    },
    "items": [
      {
        "incident_id": "__ANY__",
        "classification": "http_5xx",
        "source": "router",
        "incident_status": "__ANY__",
        "target": {
          "app_id": "app_min",
          "environment": "staging"
        },
        "deployment_id": "__ANY__",
        "run_id": "__ANY__",
        "captured_unix_ms": "__ANY__",
        "regression_status": "__ANY__"
      }
    ]
  }
}
