{
  "schema_version": "lp.cli.report@0.1.0",
  "command": "deploy stop",
  "ok": true,
  "exit_code": 0,
  "diagnostics": [],
  "meta": {
    "tool": "x07lp",
    "version": "__ANY__",
    "run_id": "__ANY__"
  },
  "result": {
    "deployment_id": "__ANY__",
    "run_id": "__ANY__",
    "final_decision_id": "__ANY__",
    "outcome": "aborted"
  }
}
