{
  "schema_version": "lp.cli.report@0.1.0",
  "command": "app unkill",
  "ok": true,
  "exit_code": 0,
  "diagnostics": [],
  "meta": {
    "tool": "x07lp",
    "version": "__ANY__",
    "run_id": "__ANY__"
  },
  "result": {
    "schema_version": "lp.control.action.result@0.1.0",
    "action_id": "__ANY__",
    "kind": "app.unkill",
    "scope": "app",
    "ok": true,
    "approval_state": "not_required",
    "created_unix_ms": "__ANY__",
    "target": {
      "app_id": "app_min",
      "environment": "staging"
    },
    "decision": {
      "decision_id": "__ANY__",
      "signature_status": "__ANY__"
    }
  }
}
