{"command":"deploy accept","diagnostics":[{"code":"LP_GATE_REJECTED","message":"x07_wasm_ops_validate_required_missing_--ops-profile","severity":"error","stage":"run"}],"exit_code":13,"meta":{"artifacts_written":[{"algo":"sha256","bytes_len":2911,"logical_name":"pack_manifest","media_type":"application/json","sha256":"0cf6d7a63a42a87c5df522f546b9f7e37496dad36f1cd970778c5c35336c962b","store_uri":"sha256:0cf6d7a63a42a87c5df522f546b9f7e37496dad36f1cd970778c5c35336c962b"},{"algo":"sha256","bytes_len":946,"logical_name":"x07.wasm.app.verify.report","media_type":"application/json","sha256":"70f0dad45111770a54777a6d824819863dd32f7aad3bcaaf5306167673665f25","store_uri":"sha256:70f0dad45111770a54777a6d824819863dd32f7aad3bcaaf5306167673665f25"},{"algo":"sha256","bytes_len":384,"logical_name":"lp.change_request","media_type":"application/json","sha256":"bdf96ecef8a3c963cbab48a155d7883797c348560ca30d3baa16004b542b06fc","store_uri":"sha256:bdf96ecef8a3c963cbab48a155d7883797c348560ca30d3baa16004b542b06fc"},{"algo":"sha256","bytes_len":2632,"logical_name":"lp.pipeline.run","media_type":"application/json","sha256":"d674249991510bea75e9db5c5fa45b3364744eb0b4fdbe152fca8c4cd5e61754","store_uri":"file:runs/lprun_mm5tvx710eqpc33bfwg5xjrtm4.json"},{"algo":"sha256","bytes_len":952,"logical_name":"lp.decision.record","media_type":"application/json","sha256":"b5d8772d1126dd20a7581eeb6450f099834c33a2e86b7a1f9ca647139fe65f2a","store_uri":"file:decisions/lpdec_kyk4m1w7y87q3ye93f0vcrdx1s.json"},{"algo":"sha256","bytes_len":210,"logical_name":"lp.deploy.execution","media_type":"application/json","sha256":"b52b2833e7f8d3d590b51c4e839048c6e2f6864df9310ded739680761cf9d578","store_uri":"file:deploy/lpexec_9ccmgv9skq8crwkd9s7g3warhn.json"}],"run_id":"lprun_mm5tvx710eqpc33bfwg5xjrtm4","tool":"x07lp","version":"0.1.0-dev"},"ok":false,"result":{"decision_digest":{"bytes_len":952,"sha256":"b5d8772d1126dd20a7581eeb6450f099834c33a2e86b7a1f9ca647139fe65f2a"},"decision_id":"lpdec_kyk4m1w7y87q3ye93f0vcrdx1s","exec_digest":{"bytes_len":210,"sha256":"b52b2833e7f8d3d590b51c4e839048c6e2f6864df9310ded739680761cf9d578"},"exec_id":"lpexec_9ccmgv9skq8crwkd9s7g3warhn","outcome":"deny","run_digest":{"bytes_len":2632,"sha256":"d674249991510bea75e9db5c5fa45b3364744eb0b4fdbe152fca8c4cd5e61754"},"run_id":"lprun_mm5tvx710eqpc33bfwg5xjrtm4"},"schema_version":"lp.cli.report@0.1.0"}