{
  "schema_version": "lp.cli.report@0.1.0",
  "command": "deploy query",
  "ok": true,
  "exit_code": 0,
  "diagnostics": [],
  "meta": {
    "tool": "x07lp",
    "version": "__ANY__",
    "run_id": "__ANY__"
  },
  "result": {
    "schema_version": "lp.deploy.query.result@0.1.0",
    "view": "timeline",
    "deployment_id": "__ANY__",
    "run_id": "__ANY__",
    "target": {
      "app_id": "app_min",
      "environment": "staging"
    },
    "resolution": {
      "by": "deployment_id",
      "requested_deployment_id": "__ANY__"
    },
    "index": {
      "used": true,
      "rebuilt": "__ANY__",
      "db_path": "__ANY__"
    },
    "steps": [
      {
        "idx": 0,
        "name": "prepare",
        "kind": "deploy.prepare",
        "status": "ok",
        "started_unix_ms": "__ANY__",
        "ended_unix_ms": "__ANY__",
        "decisions": [
          "__ANY__"
        ]
      },
      {
        "idx": 1,
        "name": "start_candidate",
        "kind": "deploy.runtime.start_candidate",
        "status": "ok",
        "started_unix_ms": "__ANY__",
        "ended_unix_ms": "__ANY__",
        "decisions": [
          "__ANY__"
        ]
      },
      {
        "idx": 2,
        "name": "set_weight_5",
        "kind": "deploy.route.set_weight",
        "status": "ok",
        "started_unix_ms": "__ANY__",
        "ended_unix_ms": "__ANY__",
        "latest_weight_pct": 5,
        "decisions": [
          "__ANY__"
        ]
      },
      {
        "idx": 3,
        "name": "pause_10",
        "kind": "deploy.pause",
        "status": "ok",
        "started_unix_ms": "__ANY__",
        "ended_unix_ms": "__ANY__",
        "decisions": [
          "__ANY__"
        ]
      },
      {
        "idx": 4,
        "name": "analysis_1",
        "kind": "deploy.analysis.slo",
        "status": "ok",
        "started_unix_ms": "__ANY__",
        "ended_unix_ms": "__ANY__",
        "analysis_decision": "promote",
        "decisions": [
          "__ANY__"
        ]
      }
    ]
  }
}
