{"command":"deploy accept","diagnostics":[{"code":"LP_GATE_REJECTED","message":"x07_wasm_ops_validate_required_missing_--ops-profile","severity":"error","stage":"run"}],"exit_code":13,"meta":{"artifacts_written":[{"algo":"sha256","bytes_len":2911,"logical_name":"pack_manifest","media_type":"application/json","sha256":"0cf6d7a63a42a87c5df522f546b9f7e37496dad36f1cd970778c5c35336c962b","store_uri":"sha256:0cf6d7a63a42a87c5df522f546b9f7e37496dad36f1cd970778c5c35336c962b"},{"algo":"sha256","bytes_len":912,"logical_name":"x07.wasm.app.verify.report","media_type":"application/json","sha256":"87483adc50caacdc071e4015dc93480d6926bee1f94c46aaed2b30476f2d82bb","store_uri":"sha256:87483adc50caacdc071e4015dc93480d6926bee1f94c46aaed2b30476f2d82bb"},{"algo":"sha256","bytes_len":384,"logical_name":"lp.change_request","media_type":"application/json","sha256":"bdf96ecef8a3c963cbab48a155d7883797c348560ca30d3baa16004b542b06fc","store_uri":"sha256:bdf96ecef8a3c963cbab48a155d7883797c348560ca30d3baa16004b542b06fc"},{"algo":"sha256","bytes_len":2632,"logical_name":"lp.pipeline.run","media_type":"application/json","sha256":"a3fc26d2d7f1543f241b92a640d1630c18b65818f3544c1c8cfdce0443167356","store_uri":"file:runs/lprun_mm5tvx710eqpc33bfwg5xjrtm4.json"},{"algo":"sha256","bytes_len":952,"logical_name":"lp.decision.record","media_type":"application/json","sha256":"63c91498de3178bb972c73c20f6b75f7d4e6f15b0d5db99d9610a0841f361e1a","store_uri":"file:decisions/lpdec_kyk4m1w7y87q3ye93f0vcrdx1s.json"},{"algo":"sha256","bytes_len":210,"logical_name":"lp.deploy.execution","media_type":"application/json","sha256":"b52b2833e7f8d3d590b51c4e839048c6e2f6864df9310ded739680761cf9d578","store_uri":"file:deploy/lpexec_9ccmgv9skq8crwkd9s7g3warhn.json"}],"run_id":"lprun_mm5tvx710eqpc33bfwg5xjrtm4","tool":"x07lp","version":"0.2.12"},"ok":false,"result":{"decision_digest":{"bytes_len":952,"sha256":"63c91498de3178bb972c73c20f6b75f7d4e6f15b0d5db99d9610a0841f361e1a"},"decision_id":"lpdec_kyk4m1w7y87q3ye93f0vcrdx1s","exec_digest":{"bytes_len":210,"sha256":"b52b2833e7f8d3d590b51c4e839048c6e2f6864df9310ded739680761cf9d578"},"exec_id":"lpexec_9ccmgv9skq8crwkd9s7g3warhn","outcome":"deny","run_digest":{"bytes_len":2632,"sha256":"a3fc26d2d7f1543f241b92a640d1630c18b65818f3544c1c8cfdce0443167356"},"run_id":"lprun_mm5tvx710eqpc33bfwg5xjrtm4"},"schema_version":"lp.cli.report@0.1.0"}