{"command":"deploy accept","diagnostics":[],"exit_code":0,"meta":{"artifacts_written":[{"algo":"sha256","bytes_len":2911,"logical_name":"pack_manifest","media_type":"application/json","sha256":"0cf6d7a63a42a87c5df522f546b9f7e37496dad36f1cd970778c5c35336c962b","store_uri":"sha256:0cf6d7a63a42a87c5df522f546b9f7e37496dad36f1cd970778c5c35336c962b"},{"algo":"sha256","bytes_len":946,"logical_name":"x07.wasm.app.verify.report","media_type":"application/json","sha256":"92b4dc266b8d93cbbdd8b533d7dc7f222a044bf018c2d925e2c31eaeeada54d7","store_uri":"sha256:92b4dc266b8d93cbbdd8b533d7dc7f222a044bf018c2d925e2c31eaeeada54d7"},{"algo":"sha256","bytes_len":356,"logical_name":"lp.change_request","media_type":"application/json","sha256":"511b5970048be6f05b88bd8bd39004cb8df0e2471ab31ec95ae9dfefa9b905fb","store_uri":"sha256:511b5970048be6f05b88bd8bd39004cb8df0e2471ab31ec95ae9dfefa9b905fb"},{"algo":"sha256","bytes_len":2635,"logical_name":"lp.pipeline.run","media_type":"application/json","sha256":"07f48f7fce209dd412af3a35d5b97c9624db5233256972bc802055c4f52cba67","store_uri":"file:runs/lprun_3q6pzkrwqwg17b9vx0ayhv9y1d.json"},{"algo":"sha256","bytes_len":871,"logical_name":"lp.decision.record","media_type":"application/json","sha256":"b1b923e9083e4ae3a9bb4fd6b4b425bf8a22ea2ecb8d11668f2ab4e0d9fa50ba","store_uri":"file:decisions/lpdec_7kx647nydasaqp7pqpcpf344mw.json"},{"algo":"sha256","bytes_len":210,"logical_name":"lp.deploy.execution","media_type":"application/json","sha256":"20dec1bc7926b78c6abb9af38c2d6f7209f67ddd153c66793e2008bebc03a594","store_uri":"file:deploy/lpexec_e1smd96aw0t3mtra0vn6y3eefw.json"}],"run_id":"lprun_3q6pzkrwqwg17b9vx0ayhv9y1d","tool":"x07lp","version":"0.2.0"},"ok":true,"result":{"decision_digest":{"bytes_len":871,"sha256":"b1b923e9083e4ae3a9bb4fd6b4b425bf8a22ea2ecb8d11668f2ab4e0d9fa50ba"},"decision_id":"lpdec_7kx647nydasaqp7pqpcpf344mw","exec_digest":{"bytes_len":210,"sha256":"20dec1bc7926b78c6abb9af38c2d6f7209f67ddd153c66793e2008bebc03a594"},"exec_id":"lpexec_e1smd96aw0t3mtra0vn6y3eefw","outcome":"allow","run_digest":{"bytes_len":2635,"sha256":"07f48f7fce209dd412af3a35d5b97c9624db5233256972bc802055c4f52cba67"},"run_id":"lprun_3q6pzkrwqwg17b9vx0ayhv9y1d"},"schema_version":"lp.cli.report@0.1.0"}